{
  "protocol": "openclaw-a2a/v1",
  "message_type": "MEMORY_CANDIDATE_PROMOTED",
  "message_id": "msg-20260410-mp-001",
  "task_id": "task-20260410-knowledge-001",
  "trace_id": "trace-20260410-knowledge-001",
  "parent_task_id": null,
  "from": "main",
  "to": "memory-system",
  "created_at": "2026-04-10T03:32:00+08:00",
  "body": {
    "candidate_ref": "${OPENCLAW_HOME}/workspace/memory/20-semantic/review-queue/RQ-20260410-001.md",
    "adopted_target": "20-semantic/decisions",
    "title": "统一知识主根优先采用 knowledge/",
    "summary": "将该知识候选提升为长期决策语义项。",
    "adopted_by": "main",
    "decision_note": "用户已确认采用 unified knowledge 主根。"
  }
}
