{
  "protocol": "openclaw-a2a/v1",
  "message_type": "PERMISSION_RESPONSE",
  "message_id": "msg-20260403-008",
  "task_id": "task-20260403-020",
  "trace_id": "trace-20260403-020",
  "parent_task_id": null,
  "from": "main",
  "to": "ops",
  "created_at": "2026-04-03T17:02:00+08:00",
  "body": {
    "decision": "approved",
    "granted_scope": "single_task",
    "constraints": [
      "仅允许截图与只读验证"
    ],
    "note": "禁止执行高风险发送动作"
  }
}
