{
  "protocol": "openclaw-a2a/v1",
  "message_type": "PERMISSION_REQUEST",
  "message_id": "msg-20260403-007",
  "task_id": "task-20260403-020",
  "trace_id": "trace-20260403-020",
  "parent_task_id": null,
  "from": "ops",
  "to": "main",
  "created_at": "2026-04-03T17:00:00+08:00",
  "body": {
    "resource_type": "tool",
    "resource_name": "playwright-cli",
    "reason": "需要登录态网页验证",
    "requested_scope": "single_task"
  }
}
