{
  "protocol": "openclaw-a2a/v1",
  "message_type": "RESULT",
  "message_id": "msg-20260403-002",
  "task_id": "task-20260403-001",
  "trace_id": "trace-20260403-001",
  "parent_task_id": null,
  "from": "research",
  "to": "main",
  "created_at": "2026-04-03T16:20:00+08:00",
  "body": {
    "status": "completed",
    "summary": "已完成研究底稿和执行摘要",
    "artifacts": [
      "/abs/path/brief.md",
      "/abs/path/findings.md",
      "/abs/path/review-note.md"
    ],
    "confidence": 0.82,
    "needs_review": true,
    "review_by": [
      "main"
    ]
  }
}
