{
  "protocol": "openclaw-a2a/v1",
  "message_type": "EVENT",
  "message_id": "msg-20260403-005",
  "task_id": "task-20260403-001",
  "trace_id": "trace-20260403-001",
  "parent_task_id": null,
  "from": "research",
  "to": "main",
  "created_at": "2026-04-03T15:30:00+08:00",
  "body": {
    "state": "in_progress",
    "progress": 0.45,
    "note": "已完成公开资料搜集，进入对比分析",
    "blockers": []
  }
}
