{
  "protocol": "openclaw-a2a/v1",
  "message_type": "KNOWLEDGE_CANDIDATE_CREATED",
  "message_id": "msg-20260410-kc-001",
  "task_id": "task-20260410-knowledge-001",
  "trace_id": "trace-20260410-knowledge-001",
  "parent_task_id": null,
  "from": "main",
  "to": "knowledge-system",
  "created_at": "2026-04-10T03:30:00+08:00",
  "body": {
    "knowledge_scope": "project",
    "candidate_type": "decision",
    "title": "正式融合版应优先作为统一知识主链验证入口",
    "summary": "当前协作与编译结果表明，正式融合版更适合作为统一知识主链的默认入口。",
    "evidence": "来源于 memory-fusion 汇总、formal fusion 运行结果和人工评审。",
    "proposed_target": "20-semantic/decisions",
    "source_refs": [
      "${OPENCLAW_HOME}/workspace/knowledge/sources/2026-04/task-20260410-031246-知识系统v2接链验证-fusion.md"
    ],
    "related_pages": [
      "${OPENCLAW_HOME}/workspace/knowledge/projects/openclaw-knowledge-system-v2.md"
    ],
    "review_queue_ref": "${OPENCLAW_HOME}/workspace/memory/20-semantic/review-queue/RQ-20260410-001.md"
  }
}
