{
  "protocol": "openclaw-a2a/v1",
  "message_type": "PROCEDURE_PROMOTED",
  "message_id": "msg-20260410-pp-001",
  "task_id": "task-20260410-knowledge-001",
  "trace_id": "trace-20260410-knowledge-001",
  "parent_task_id": null,
  "from": "main",
  "to": "ops",
  "created_at": "2026-04-10T03:33:00+08:00",
  "body": {
    "procedure_path": "${OPENCLAW_HOME}/workspace/memory/30-procedures/KNOWLEDGE-COMPILATION-SOP.md",
    "title": "统一知识编译流程",
    "summary": "规定 memory-fusion 输出要先进入 knowledge compiler，再决定是否进入长期规则层。",
    "promoted_from": "${OPENCLAW_HOME}/workspace/memory/20-semantic/review-queue/RQ-20260410-009.md",
    "approved_by": "main",
    "rollout_scope": "default"
  }
}
